,Sentiment,Sentiment Num,Multi,Text
527,Negative,-1,-1,Birot  's   directorial   debut   -LRB-    she   co-wrote    the  script   with   Christophe  Honoré  -RRB-      is  n't   so   much  bad   as   it   is  bland  .
528,Neutral,0,0,Just   how  extreme    are   these  ops  ?
529,Negative,-1,-1,John  Leguizamo    may   be     a   dramatic  actor  --    just  not   in   this  movie  .
530,Negative,-1,-1,The  Master   Of  Disaster   -   it    's    a  piece   of   dreck   disguised   as  comedy  .
531,Negative,-1,-2,"The   stupidest   ,    most  insulting  movie   of  2002    's   first  quarter  ."
532,Negative,-1,-2,A  film    so  tedious     that   it   is   impossible   to   care   whether    that  boast   is  true  or  not  .
533,Negative,-1,-2,"A  film      made   with   as        little  wit  ,  interest  ,  and  professionalism   as   artistically  possible   for   a   slummy   Hollywood   caper  flick  ."
534,Negative,-1,-1,Disturbingly     superficial   in   its  approach   to   the  material  .
535,Positive,1,1,An   imaginative   comedy\/thriller  .
